{
  "$schema": "https://json-schema.org/draft-07/schema#",
  "$id": "https://cliphub.fyi/registry/schema.json",
  "title": "Plugin Registry Pointer",
  "description": "A minimal pointer to a Paperclip plugin published on npm. Plugin metadata (displayName, capabilities, etc.) is extracted from the package's built manifest at CI time and stored in registry/manifests/{slug}.json.",
  "type": "object",
  "required": ["npmPackage", "addedBy", "category"],
  "additionalProperties": false,
  "properties": {
    "$schema": { "type": "string" },
    "npmPackage": {
      "type": "string",
      "description": "Exact npm package name (e.g. paperclip-foo or @scope/foo).",
      "pattern": "^(@[a-z0-9-~][a-z0-9-._~]*/)?[a-z0-9-~][a-z0-9-._~]*$"
    },
    "addedBy": {
      "type": "string",
      "description": "GitHub handle of the submitter. Audit only; git history is canonical.",
      "minLength": 1,
      "pattern": "^[a-zA-Z0-9](?:[a-zA-Z0-9]|-(?=[a-zA-Z0-9])){0,38}$"
    },
    "category": {
      "type": "string",
      "description": "Hub-curated category for marketplace navigation. Distinct from the manifest's own categories array, which is the plugin author's classification.",
      "enum": ["auth", "provider", "tools", "integration", "observability", "memory", "other"]
    },
    "sourceRepo": {
      "type": "string",
      "description": "Optional. URL of the plugin's source repository (informational).",
      "format": "uri"
    },
    "kind": {
      "type": "string",
      "description": "Optional, default \"plugin\". Decides the install command shown: plugin -> `plugin install`, adapter -> `adapter install`, library (SDKs etc.) -> not installable, never listed.",
      "enum": ["plugin", "adapter", "library"]
    },
    "quarantine": {
      "type": "string",
      "description": "Optional. If set, the entry is hidden from the site and the index, and this short reason is published under `quarantined`. Used when the package fails to install on a real Paperclip instance.",
      "minLength": 1,
      "maxLength": 300
    }
  }
}
