{
  "$schema": "../schema.json",
  "npmPackage": "@smara/paperclip-plugin-memory",
  "addedBy": "lacymorrow",
  "category": "memory",
  "sourceRepo": "https://github.com/smara-io/paperclip-plugin",
  "quarantine": "Install fails on paperclipai 2026.1012.0: worker setup() calls config.get without a company context and the host rejects it. Needs a plugin update."
}
