{
  "$schema": "../schema.json",
  "npmPackage": "@blaze283/social-agent-plugin",
  "addedBy": "lacymorrow",
  "category": "integration",
  "quarantine": "Install fails on paperclipai 2026.1012.0: worker setup() calls config.get without a company context and the host rejects it. Needs a plugin update."
}
