{
  "$schema": "../schema.json",
  "npmPackage": "@gaud_erp/social-networking",
  "addedBy": "lacymorrow",
  "category": "integration",
  "sourceRepo": "https://github.com/gauderp/papperclip-social-networking",
  "quarantine": "Install rejected by paperclipai 2026.1012.0: plugin migrations must use fully qualified schema names."
}
