{
  "$schema": "../schema.json",
  "npmPackage": "@oldharlem/paperclip-plugin-linear",
  "addedBy": "lacymorrow",
  "category": "integration",
  "sourceRepo": "https://github.com/Oldharlem/paperclip-linear-plugin",
  "quarantine": "Install fails on paperclipai 2026.1012.0: worker setup() calls config.get without a company context and the host rejects it. Needs a plugin update."
}
